{"$schema":"https://json-schema.org/draft/2020-12/schema","$id":"provan.session11_closeout.v1","type":"object","additionalProperties":false,"required":["schema_id","status","implementation_binding","reviewed_pre_review_root","final_proof_root","reviewer_receipts","go_session12","session12_implemented","session13_implemented","release_created","tag_created","package_published","production_changed_after_review"],"properties":{"schema_id":{"const":"provan.session11_closeout.v1"},"status":{"const":"CLOSED"},"implementation_binding":{"type":"object","minProperties":8},"reviewed_pre_review_root":{"type":"string","pattern":"^sha256:[0-9a-f]{64}$"},"final_proof_root":{"type":"string","pattern":"^sha256:[0-9a-f]{64}$"},"reviewer_receipts":{"type":"array","minItems":2,"maxItems":2,"items":{"$ref":"#/$defs/ref"}},"go_session12":{"type":"boolean"},"session12_implemented":{"const":false},"session13_implemented":{"const":false},"release_created":{"const":false},"tag_created":{"const":false},"package_published":{"const":false},"production_changed_after_review":{"const":false}},"$defs":{"ref":{"type":"object","additionalProperties":false,"required":["path","sha256"],"properties":{"path":{"type":"string"},"sha256":{"type":"string","pattern":"^sha256:[0-9a-f]{64}$"}}}}}
