{"final_proof_root":"sha256:2fac07bebac0124515026e7eac8aff851cd3080e08a9424d42ea17b7ec0f2941","go_session12":true,"implementation_binding":{"claim_registry_digest":"sha256:0ead7bf736f100a930a60ec8bbeca0090f993d7fdd6a49e552a0aea7c4fa6cf8","extension_api_major":1,"implementation_commit":"4cd6d18d9f6b471cb592776078531aa24aa7c07f","implementation_tree":"8dc237166d15dfe334a99d884acee3ecd9dac9c6","maturity":"QUALIFIED_BOUNDED","package_version":"0.4.0","published":false,"schema_id":"provan.session11_implementation_binding.v1","schema_registry_digest":"sha256:4883f894956a1a6c20135138a529c416ebd10004eea8931808a830054ff43758","wheel_sha256":"sha256:07eebfe37cade6834eae19676a7c53d9bbbc9df85b8c21ac200ecaf1105046c2"},"package_published":false,"production_changed_after_review":false,"release_created":false,"reviewed_pre_review_root":"sha256:739dd66022288b16acf971fc35e447c24145f64273d97c9df0a25aa87dd3aeeb","reviewer_receipts":[{"path":"artifacts/session11/proofs/reviewer_receipt_a.v1.public.json","sha256":"sha256:0d8dbccbe9de90d665394603590b45ec8bdd911ae1787a21cf3604099b46f509"},{"path":"artifacts/session11/proofs/reviewer_receipt_b.v1.public.json","sha256":"sha256:dd7ba58947da463dafa4f6a33627803968d5d73f92a558933fe59adeb2986adf"}],"schema_id":"provan.session11_closeout.v1","session12_implemented":false,"session13_implemented":false,"status":"CLOSED","tag_created":false}
